4;Belostoss in the room located east of the room where the Tydal Wyrm appears
5;Rightmost Water Strider in the room located east of the room where the Tydal Wyrm appears
6;Leftmost Water Strider in the room located east of the room where the Tydal Wyrm appears
8;Water Strider in the room locates east from the west entrance
9;Belostoss in the room locates east from the west entrance
10;Diving Spider in the room locates east from the west entrance
12;Water Strider in room with a crystal and exactly 2 tree branches
13;Diving Spider in room with a crystal and exactly 2 tree branches
14;Belostoss in the first room from the east entrance